{
  "$schema": "https://json-schema.org/draft/2020-12/schema",
  "$id": "https://rules-residue.invalid/schemas/story-construction/precontent-final-receipt-v2.schema.json",
  "title": "Pre-Content Final Tracked Inner Activation Receipt",
  "type": "object",
  "additionalProperties": false,
  "required": ["schema_version", "receipt_kind", "outer_envelope_schema", "payload", "payload_hash"],
  "properties": {
    "schema_version": {"const": "rules-residue.story-construction.precontent-final-receipt/2.0.0"},
    "receipt_kind": {"const": "TRACKED_INNER_ACTIVATION_RECEIPT"},
    "outer_envelope_schema": {"const": "schemas/story-construction/precontent-activation-closeout-envelope-v1.schema.json"},
    "payload": {
      "type": "object",
      "additionalProperties": false,
      "required": [
        "schema_version", "receipt_id", "receipt_status", "change_set_id",
        "machine_milestone", "machine_batch_id", "activation_model", "lifecycle_stage",
        "disposition", "release", "base_commit", "base_tree", "base_canon_hash",
        "proposed_canon_hash", "implementation_candidate", "implementation_owner_approval",
        "implementation_acceptance", "approval_consumption_record", "framework_manifest_r1",
        "framework_manifest_r2", "schema_sets", "fixed_preservation",
        "activation_path_allowlist", "provider_request_counts", "activation_state"
      ],
      "properties": {
        "schema_version": {"const": "rules-residue.story-construction.precontent-final-receipt/2.0.0"},
        "receipt_id": {"const": "SCG-PRECONTENT-READINESS-R1-FINAL-001"},
        "receipt_status": {"const": "PENDING_OWNER_ACTIVATION_HASH_APPROVAL_M3_B002"},
        "change_set_id": {"const": "CS-SCG-PRECONTENT-READINESS-R1-001"},
        "machine_milestone": {"const": "M3"},
        "machine_batch_id": {"const": "M3-B002"},
        "activation_model": {"const": "MODEL_B_FULL_FRAMEWORK_HASH_REAPPROVAL"},
        "lifecycle_stage": {"const": "APPROVED"},
        "disposition": {"const": "ACTIVE"},
        "release": {"const": "NOT_RELEASED"},
        "base_commit": {"const": "6f9f671401f5857d460ca8e0bd8a86ebe04bb0b6"},
        "base_tree": {"const": "2dfa6553770f4eedbb4def358f661b9b16b79a4d"},
        "base_canon_hash": {"const": "d7ceea75615b57970f3b9712b73ed4c9f65a9c4406c877e9013470cb53a6141a"},
        "proposed_canon_hash": {"const": "d7ceea75615b57970f3b9712b73ed4c9f65a9c4406c877e9013470cb53a6141a"},
        "implementation_candidate": {
          "type": "object", "additionalProperties": false, "required": ["commit", "tree", "parent"],
          "properties": {
            "commit":{"const":"74fecbe6984f150f83c364e5d5a5850132cfc147"},
            "tree":{"const":"b81fa075a1b812478dbc3e196429c7392279e28f"},
            "parent":{"const":"6f9f671401f5857d460ca8e0bd8a86ebe04bb0b6"}
          }
        },
        "implementation_owner_approval": {
          "type": "object", "additionalProperties": false,
          "required": ["approval_id", "raw_sha256", "canonical_sha256", "consumed", "single_use", "transferable"],
          "properties": {
            "approval_id":{"const":"OWNER-APPROVAL-SCG-PRECONTENT-M3-B002-CANDIDATE-74FECBE6-R1"},
            "raw_sha256":{"const":"f2ee360dd75b25d6e8f6869dc2a19e0dc2edb5b635cc007ff57aeacd6e5c5700"},
            "canonical_sha256":{"const":"25908c90f0af7ce99fe736536991971c9a8cbaf2b6617fc9c4aedc8e198281d9"},
            "consumed":{"const":true},"single_use":{"const":true},"transferable":{"const":false}
          }
        },
        "implementation_acceptance": {
          "type": "object", "additionalProperties": false,
          "required": ["task_id", "result", "verifier", "route", "route_digest"],
          "properties": {
            "task_id":{"const":"SCG-PRECONTENT-M3-B002-ACCEPT-001"},
            "result":{"const":"PASS_FIXED_M3_B002_CANDIDATE_ACCEPTED"},
            "verifier":{"const":"CODEX-INDEPENDENT-VERIFIER-SCG-PRECONTENT-M3-B002-ACCEPT-001"},
            "route":{"const":"SCG-PRECONTENT-M3-B002-ACCEPT"},
            "route_digest":{"const":"b08bfd965a6c8ca8515460f5507e212056ab8b6e6d65fc9d53b7976b2a95af76"}
          }
        },
        "approval_consumption_record": {
          "type": "object", "additionalProperties": false, "required": ["path", "file_sha256"],
          "properties": {
            "path":{"const":"governance/story-construction/approvals/OWNER-APPROVAL-SCG-PRECONTENT-M3-B002-CANDIDATE-74FECBE6-R1.consumption.json"},
            "file_sha256":{"type":"string","pattern":"^[0-9a-f]{64}$"}
          }
        },
        "framework_manifest_r1": {
          "type": "object", "additionalProperties": false,
          "required": ["path", "file_sha256", "merkle_root", "record_count"],
          "properties": {
            "path":{"const":"governance/story-construction/precontent/manifests/framework-manifest.r1.json"},
            "file_sha256":{"const":"891944f172236b666eb78bc641f4e7ecabf6ec3e318ab4cd0b5858f045b06b67"},
            "merkle_root":{"const":"87c6520fe0822e29312de6c72cad95f0849aa3d0bd4fbb27f97f1f786027bf8f"},
            "record_count":{"const":68}
          }
        },
        "framework_manifest_r2": {
          "type": "object", "additionalProperties": false,
          "required": ["path", "file_sha256", "merkle_root", "record_count", "transition"],
          "properties": {
            "path":{"const":"governance/story-construction/precontent/manifests/framework-manifest.r2.json"},
            "file_sha256":{"type":"string","pattern":"^[0-9a-f]{64}$"},
            "merkle_root":{"type":"string","pattern":"^[0-9a-f]{64}$"},
            "record_count":{"const":76},
            "transition": {
              "type":"object","additionalProperties":false,
              "required":["old_record_count","unchanged_old_count","changed_old_count","new_record_count","total_record_count","unchanged_old_leaf_set_hash","changed_old_leaf_transition_hash","new_leaf_set_hash","r1_leaf_set_hash","r2_leaf_set_hash"],
              "properties": {
                "old_record_count":{"const":68},"unchanged_old_count":{"const":61},"changed_old_count":{"const":7},"new_record_count":{"const":8},"total_record_count":{"const":76},
                "unchanged_old_leaf_set_hash":{"type":"string","pattern":"^[0-9a-f]{64}$"},
                "changed_old_leaf_transition_hash":{"type":"string","pattern":"^[0-9a-f]{64}$"},
                "new_leaf_set_hash":{"type":"string","pattern":"^[0-9a-f]{64}$"},
                "r1_leaf_set_hash":{"type":"string","pattern":"^[0-9a-f]{64}$"},
                "r2_leaf_set_hash":{"type":"string","pattern":"^[0-9a-f]{64}$"}
              }
            }
          }
        },
        "schema_sets": {
          "type":"object","additionalProperties":false,
          "required":["original_schema_count","original_schema_set_hash","activation_schema_count","activation_schema_set_hash","combined_schema_count","combined_schema_set_hash"],
          "properties": {
            "original_schema_count":{"const":20},"original_schema_set_hash":{"const":"77c8d831c2fd4b79edc597215135ca111fd76b1e00b9d126fda5a4d1a7fcdc50"},
            "activation_schema_count":{"const":5},"activation_schema_set_hash":{"type":"string","pattern":"^[0-9a-f]{64}$"},
            "combined_schema_count":{"const":25},"combined_schema_set_hash":{"type":"string","pattern":"^[0-9a-f]{64}$"}
          }
        },
        "fixed_preservation": {
          "type":"object","additionalProperties":false,
          "required":["decision_set_hash","partial_supersession_hash","traceability_hash","pending_receipt_file_sha256","pending_receipt_payload_hash","m0_fixture_graph_hash","context_manifest_set_hash","omission_report_set_hash","static_gate_result_hash","provider_profile_contract_set_hash","provider_zero_call_evidence_hash","canon_hash","runtime_package_sha256"],
          "properties": {
            "decision_set_hash":{"const":"0e01181acbc9fb95c57ed1b910a3b561545e8824f0c60d7fdc35c93cff44146d"},
            "partial_supersession_hash":{"const":"45bcd35ef9c18dea5e300c163ef232692a77b42ea9b11d9b555df118f74206da"},
            "traceability_hash":{"const":"a0ed82836894d8d809447aa0b5d8cb8a05dfff87b363701b719de68f90b8359a"},
            "pending_receipt_file_sha256":{"const":"1fa87cf4d7a7e2cb876f832a685d3a74c7200653428e8a0f82f0dd3f856ee206"},
            "pending_receipt_payload_hash":{"const":"c7aa1758a86df27d39b6baf153d4adb69cff81d5e496c4cdb5456659c8d28a28"},
            "m0_fixture_graph_hash":{"const":"7319d3670ae280d4a32fc2e40aa8412faeb4dc465092b067e0147574734c7807"},
            "context_manifest_set_hash":{"const":"e638858d4fe7b2baa7bcbe5648ee611e13e9e54252cf43ffe51cc494c6a386df"},
            "omission_report_set_hash":{"const":"1c8a3d062d89fe49830bb0ad43fa13e04d7fed9b997046b09a927c4179d53aa9"},
            "static_gate_result_hash":{"const":"a5acc295f30d1b81739b4c2064ea57356900cc375736b9a20e1feb2177f07dc5"},
            "provider_profile_contract_set_hash":{"const":"dc1a5b37bc42f0d9f97ceac9f34460138009a79499304ac1844ef77e21ceb3e5"},
            "provider_zero_call_evidence_hash":{"const":"e6536a180aeb21b20ca9b65594610e65c50d72bf388b513533bed799366214f5"},
            "canon_hash":{"const":"d7ceea75615b57970f3b9712b73ed4c9f65a9c4406c877e9013470cb53a6141a"},
            "runtime_package_sha256":{"const":"29ea1e0278e37d183d4c0ff396437088b4873c58c5e9a9c857093f6c552a6314"}
          }
        },
        "activation_path_allowlist": {
          "type":"object","additionalProperties":false,"required":["path_count","sha256"],
          "properties":{"path_count":{"const":18},"sha256":{"type":"string","pattern":"^[0-9a-f]{64}$"}}
        },
        "provider_request_counts": {
          "type":"object","additionalProperties":false,"required":["deepseek","grok","opencode","story_m0"],
          "properties":{"deepseek":{"const":0},"grok":{"const":0},"opencode":{"const":0},"story_m0":{"const":0}}
        },
        "activation_state": {
          "type":"object","additionalProperties":false,
          "required":["tracked_target_state","active_wip","authoritative_activation_effective","required_external_proofs"],
          "properties": {
            "tracked_target_state":{"const":"TRACKED_B002_TARGET_STATE_ACTIVE"},"active_wip":{"const":true},"authoritative_activation_effective":{"const":false},
            "required_external_proofs":{"type":"array","minItems":4,"maxItems":4,"uniqueItems":true,"items":{"enum":["ACTIVATION_SPECIFIC_OWNER_FULL_HASH_APPROVAL","PASS_FIXED_M3_B002_ACTIVATION_CANDIDATE_ACCEPTED","VALID_DETACHED_ACCEPTED_ACTIVATION_ENVELOPE_TAG","FINAL_FAST_FORWARD_INTEGRATION"]}}
          }
        }
      }
    },
    "payload_hash": {"type": "string", "pattern": "^[0-9a-f]{64}$"}
  }
}
