{"outer_envelope_schema":"schemas/story-construction/precontent-activation-closeout-envelope-v1.schema.json","payload":{"activation_model":"MODEL_B_FULL_FRAMEWORK_HASH_REAPPROVAL","activation_path_allowlist":{"path_count":18,"sha256":"d661da0852597450eefeae13fac86380c7cd8139a93ec1632352c35516753eb9"},"activation_state":{"active_wip":true,"authoritative_activation_effective":false,"required_external_proofs":["ACTIVATION_SPECIFIC_OWNER_FULL_HASH_APPROVAL","PASS_FIXED_M3_B002_ACTIVATION_CANDIDATE_ACCEPTED","VALID_DETACHED_ACCEPTED_ACTIVATION_ENVELOPE_TAG","FINAL_FAST_FORWARD_INTEGRATION"],"tracked_target_state":"TRACKED_B002_TARGET_STATE_ACTIVE"},"approval_consumption_record":{"file_sha256":"f6db317c135f1af4993a875291929c6632c1682774ac6799b7b4f98adc630282","path":"governance/story-construction/approvals/OWNER-APPROVAL-SCG-PRECONTENT-M3-B002-CANDIDATE-74FECBE6-R1.consumption.json"},"base_canon_hash":"d7ceea75615b57970f3b9712b73ed4c9f65a9c4406c877e9013470cb53a6141a","base_commit":"6f9f671401f5857d460ca8e0bd8a86ebe04bb0b6","base_tree":"2dfa6553770f4eedbb4def358f661b9b16b79a4d","change_set_id":"CS-SCG-PRECONTENT-READINESS-R1-001","disposition":"ACTIVE","fixed_preservation":{"canon_hash":"d7ceea75615b57970f3b9712b73ed4c9f65a9c4406c877e9013470cb53a6141a","context_manifest_set_hash":"e638858d4fe7b2baa7bcbe5648ee611e13e9e54252cf43ffe51cc494c6a386df","decision_set_hash":"0e01181acbc9fb95c57ed1b910a3b561545e8824f0c60d7fdc35c93cff44146d","m0_fixture_graph_hash":"7319d3670ae280d4a32fc2e40aa8412faeb4dc465092b067e0147574734c7807","omission_report_set_hash":"1c8a3d062d89fe49830bb0ad43fa13e04d7fed9b997046b09a927c4179d53aa9","partial_supersession_hash":"45bcd35ef9c18dea5e300c163ef232692a77b42ea9b11d9b555df118f74206da","pending_receipt_file_sha256":"1fa87cf4d7a7e2cb876f832a685d3a74c7200653428e8a0f82f0dd3f856ee206","pending_receipt_payload_hash":"c7aa1758a86df27d39b6baf153d4adb69cff81d5e496c4cdb5456659c8d28a28","provider_profile_contract_set_hash":"dc1a5b37bc42f0d9f97ceac9f34460138009a79499304ac1844ef77e21ceb3e5","provider_zero_call_evidence_hash":"e6536a180aeb21b20ca9b65594610e65c50d72bf388b513533bed799366214f5","runtime_package_sha256":"29ea1e0278e37d183d4c0ff396437088b4873c58c5e9a9c857093f6c552a6314","static_gate_result_hash":"a5acc295f30d1b81739b4c2064ea57356900cc375736b9a20e1feb2177f07dc5","traceability_hash":"a0ed82836894d8d809447aa0b5d8cb8a05dfff87b363701b719de68f90b8359a"},"framework_manifest_r1":{"file_sha256":"891944f172236b666eb78bc641f4e7ecabf6ec3e318ab4cd0b5858f045b06b67","merkle_root":"87c6520fe0822e29312de6c72cad95f0849aa3d0bd4fbb27f97f1f786027bf8f","path":"governance/story-construction/precontent/manifests/framework-manifest.r1.json","record_count":68},"framework_manifest_r2":{"file_sha256":"43346ea1c462cc70d2c1e4855351d111e9f6cfa263a7aeca6f5821d4d3a00a8f","merkle_root":"5c272518a3acd983bc8b5cea5290f77ec5da15f291baac7ade39fd32d699aeea","path":"governance/story-construction/precontent/manifests/framework-manifest.r2.json","record_count":76,"transition":{"changed_old_count":7,"changed_old_leaf_transition_hash":"4e0a18ee6d99fd2db5eb90e98407eb7694853e2663faff564adeb8c3bf40e9c9","new_leaf_set_hash":"01d07233721f4f1b2e1c77b4b1fe9dce9b7bf9a4a355d9dafb9462ecd772228e","new_record_count":8,"old_record_count":68,"r1_leaf_set_hash":"f686af29e6956a243d4a2e4eb2898a1c630d808e3035b5bd27f123771aa58ce1","r2_leaf_set_hash":"5412098396d68825a10a18b2128dbd46e54209d1e355f2a2a7f3f5e2c936cbf7","total_record_count":76,"unchanged_old_count":61,"unchanged_old_leaf_set_hash":"133d8bbd84969dde87ee3f7e788ac69818c2981ec80d0ac5707a7f5f537a6ce1"}},"implementation_acceptance":{"result":"PASS_FIXED_M3_B002_CANDIDATE_ACCEPTED","route":"SCG-PRECONTENT-M3-B002-ACCEPT","route_digest":"b08bfd965a6c8ca8515460f5507e212056ab8b6e6d65fc9d53b7976b2a95af76","task_id":"SCG-PRECONTENT-M3-B002-ACCEPT-001","verifier":"CODEX-INDEPENDENT-VERIFIER-SCG-PRECONTENT-M3-B002-ACCEPT-001"},"implementation_candidate":{"commit":"74fecbe6984f150f83c364e5d5a5850132cfc147","parent":"6f9f671401f5857d460ca8e0bd8a86ebe04bb0b6","tree":"b81fa075a1b812478dbc3e196429c7392279e28f"},"implementation_owner_approval":{"approval_id":"OWNER-APPROVAL-SCG-PRECONTENT-M3-B002-CANDIDATE-74FECBE6-R1","canonical_sha256":"25908c90f0af7ce99fe736536991971c9a8cbaf2b6617fc9c4aedc8e198281d9","consumed":true,"raw_sha256":"f2ee360dd75b25d6e8f6869dc2a19e0dc2edb5b635cc007ff57aeacd6e5c5700","single_use":true,"transferable":false},"lifecycle_stage":"APPROVED","machine_batch_id":"M3-B002","machine_milestone":"M3","proposed_canon_hash":"d7ceea75615b57970f3b9712b73ed4c9f65a9c4406c877e9013470cb53a6141a","provider_request_counts":{"deepseek":0,"grok":0,"opencode":0,"story_m0":0},"receipt_id":"SCG-PRECONTENT-READINESS-R1-FINAL-001","receipt_status":"PENDING_OWNER_ACTIVATION_HASH_APPROVAL_M3_B002","release":"NOT_RELEASED","schema_sets":{"activation_schema_count":5,"activation_schema_set_hash":"86d86a286fd1bbd3810720b943d61c1e00c3a63c9e6aed714f6e40d072b90b7f","combined_schema_count":25,"combined_schema_set_hash":"fa449a7d44f2bf763f663a6df40b3a344cb978871a70fa9bd59ff685d1df48dd","original_schema_count":20,"original_schema_set_hash":"77c8d831c2fd4b79edc597215135ca111fd76b1e00b9d126fda5a4d1a7fcdc50"},"schema_version":"rules-residue.story-construction.precontent-final-receipt/2.0.0"},"payload_hash":"9584cf8bd5cf9830ad5b4b2577c0cd843c63d6b7d84cd8eb7a2bc3b0cafcacfc","receipt_kind":"TRACKED_INNER_ACTIVATION_RECEIPT","schema_version":"rules-residue.story-construction.precontent-final-receipt/2.0.0"}
